{"procedure_id":"design-verification","revision":"1.0.0","intent":"Convert an acceptance oracle into executable positive, negative and boundary verification.","invocation_mode":"explicit_only","required_inputs":["acceptance_oracle","work_unit","risk_strategy"],"steps":["Map each oracle scenario to a verification level","Design fixtures, thresholds and negative tests","Identify missing or non-executable acceptance conditions"],"required_outputs":["verification_plan","coverage_map","acceptance_gaps"],"invariants":["The strategist does not approve its own acceptance criteria","Required risk checks cannot be removed"]}
